{
 "$schema": "https://json-schema.org/draft/2020-12/schema",
 "title": "Fleet lock (tests/contracts/fleet.lock)",
 "type": "object",
 "required": [
  "framework",
  "contracts",
  "environment"
 ],
 "properties": {
  "comment": {
   "type": "string"
  },
  "framework": {
   "type": "string"
  },
  "contracts": {
   "type": "object",
   "minProperties": 1,
   "additionalProperties": {
    "type": "object",
    "required": [
     "integration",
     "checkpoints"
    ],
    "additionalProperties": false,
    "properties": {
     "integration": {
      "type": "object",
      "required": [
       "repo",
       "revision"
      ],
      "properties": {
       "repo": {
        "type": "string",
        "pattern": "^[\\w.-]+/[\\w.-]+$"
       },
       "revision": {
        "type": "string",
        "minLength": 1,
        "description": "commit sha of the published contract repository, or 'unpublished' for a folder only in example/hub"
       },
       "path": {
        "type": "string",
        "description": "the contract's source folder, published by publish_contracts.py (run with --local-contracts while editing); only needed for unpublished contracts, --local-contracts, and script contracts"
       },
       "files_sha256": {
        "type": "string",
        "pattern": "^[0-9a-f]{64}$",
        "description": "sha256 of the contract's {path: sha256} file map (README.md excluded), sorted JSON"
       }
      }
     },
     "fixtures": {
      "type": "object",
      "propertyNames": {
       "type": "string",
       "pattern": "^[\\w.-]+/[\\w.-]+$"
      },
      "additionalProperties": {
       "type": "object",
       "required": [
        "revision"
       ],
       "additionalProperties": false,
       "properties": {
        "revision": {
         "type": "string",
         "minLength": 1,
         "description": "commit sha, or 'unpublished' for the folders in example/hub"
        },
        "path": {
         "type": "string",
         "description": "the fixture's build folder; only needed for unpublished fixtures and --local-fixtures"
        },
        "files_sha256": {
         "type": "string",
         "pattern": "^[0-9a-f]{64}$",
         "description": "sha256 of the fixture's build.json sha256 map, sorted JSON"
        }
       }
      }
     },
     "checkpoints": {
      "type": "object",
      "propertyNames": {
       "type": "string",
       "pattern": "^[\\w.-]+/[\\w.-]+$"
      },
      "additionalProperties": {
       "type": "string",
       "pattern": "^[0-9a-f]{40}$"
      }
     },
     "artifacts": {
      "type": "object",
      "propertyNames": {
       "type": "string",
       "pattern": "^[\\w.-]+/[\\w.-]+$"
      },
      "additionalProperties": {
       "type": "string",
       "pattern": "^[0-9a-f]{40}$"
      }
     }
    }
   }
  },
  "environment": {
   "type": "object",
   "additionalProperties": {
    "type": "string"
   }
  },
  "known_failures": {
   "type": "object",
   "description": "<contract>/<target> -> a bug in the framework under test. A string (reason with issue link) makes any failure of the target xfail; an object narrows it to failures matching `match`, or leaves `skip_outputs` out of the comparison",
   "additionalProperties": {
    "oneOf": [
     {
      "type": "string",
      "minLength": 1
     },
     {
      "type": "object",
      "required": [
       "issue"
      ],
      "additionalProperties": false,
      "minProperties": 2,
      "properties": {
       "issue": {
        "type": "string",
        "minLength": 1,
        "description": "issue link and one-line reason"
       },
       "match": {
        "type": "string",
        "minLength": 1,
        "description": "xfail only when every failure line contains this text"
       },
       "skip_outputs": {
        "type": "array",
        "minItems": 1,
        "items": {
         "type": "string"
        },
        "description": "outputs left out of the comparison while the bug is open"
       }
      }
     }
    ]
   }
  },
  "local_patches": {
   "type": "object",
   "description": "patch name (example/patches.py) -> reason with issue link; applied before every contract and recorded in each result's environment",
   "additionalProperties": {
    "type": "string",
    "minLength": 1
   }
  }
 }
}
