{
  "comment": "Model integration contracts pinned for Transformers CI, vendored from huggingface/model-integration-contracts (example/transformers/tests/contracts/fleet.lock at fb28215) without paths or local_patches. Run: python utils/contracts/run.py --framework transformers --fixtures-only --lock tests/contracts/fleet-lock.json",
  "framework": "transformers",
  "contracts": {
    "SmolLM": {
      "integration": {
        "repo": "hf-internal-testing/SmolLM-integration",
        "revision": "d52a4cb53b22c728c547919e9a3549ce6e620aac",
        "files_sha256": "62f72590b7bec062126bde87aa3446fbb3369eef38cee0d26ab1e08d9ea42fb8"
      },
      "fixtures": {
        "hf-internal-testing/mic-SmolLM-slim": {
          "revision": "50eacd46dbec7d33ef11b930e986399a5a8f1a43",
          "files_sha256": "8562493b1bb64ef7fd81ceb10b47e69aa135afe9ea31385d2b3dfaaf92ba330d"
        },
        "hf-internal-testing/mic-SmolLM-1.7B-slim": {
          "revision": "58a736e869e5f9f59984b467b84e42f1aaa14d08",
          "files_sha256": "d6cb7aae64669f6d15ed9cbc6004396e3c12e1a9c7b2d6b41b5e1c70ca61c48b"
        }
      },
      "checkpoints": {
        "HuggingFaceTB/SmolLM-135M": "1d461723eec654e65efdc40cf49301c89c0c92f4",
        "HuggingFaceTB/SmolLM-360M": "59f7ef243ee09a72cbc14cb054393a3e3b771d41",
        "HuggingFaceTB/SmolLM-1.7B": "d7449ff7241c863f3e8accc475155f0f97afa011"
      }
    },
    "CLIP": {
      "integration": {
        "repo": "hf-internal-testing/CLIP-integration",
        "revision": "423a026e65fe49bdc292fb25d0a67f8467f6f004",
        "files_sha256": "67fec181d09b27f23fea1cb73a7c795a1519bb83d0ae74803c0ce406e8a27be1"
      },
      "fixtures": {
        "hf-internal-testing/mic-clip-vit-base-patch32-slim": {
          "revision": "adad0f30de071148ab0b55bb2263ac909e58cc5b",
          "files_sha256": "e72402276836e7b27c96687600cde8e3612a82e7b6e9d69a0523626816f99e1d"
        }
      },
      "checkpoints": {
        "openai/clip-vit-base-patch32": "3d74acf9a28c67741b2f4f2ea7635f0aaf6f0268"
      }
    },
    "BERT": {
      "integration": {
        "repo": "hf-internal-testing/BERT-integration",
        "revision": "6a667eafaa05f8ff3c07e7698ce768d6271b1a79",
        "files_sha256": "4b793a38bc579f00049ee0f9041d21e77dcf1d278db62a6b0f7ac9c4c668add0"
      },
      "fixtures": {
        "hf-internal-testing/mic-bert-base-uncased-slim": {
          "revision": "a1f96617d0b6c9f76ed6822ec843c922da95878b",
          "files_sha256": "10e7f1627bf4615e202df67f40abbeb5070a88fd9741a257fbf71dee21daf16f"
        }
      },
      "checkpoints": {
        "google-bert/bert-base-uncased": "86b5e0934494bd15c9632b12f734a8a67f723594"
      }
    },
    "T5": {
      "integration": {
        "repo": "hf-internal-testing/T5-integration",
        "revision": "2fe60bcd6fbdf615d93cd1599a5776459e7646bf",
        "files_sha256": "4bacd86fc6c7f91cd5c1a8bf06d0350ddc8dae7652345929525c152bdca64032"
      },
      "fixtures": {
        "hf-internal-testing/mic-t5-small-slim": {
          "revision": "4f4d0ca0db8f1823e53ac0cbcba28bd982b6e8f4",
          "files_sha256": "530a553b936f1a6c0a68b8e394e30319fd0ae38dc76718fe55c47212d053f8a6"
        },
        "hf-internal-testing/mic-umt5-small-slim": {
          "revision": "5c2db1c75f56bce8b4c200734810eb07f29bfcc3",
          "files_sha256": "91a8c18974956cfd1e6e08cb6ec8f056b10d12ada1a3e8d35acee48a995634ac"
        }
      },
      "checkpoints": {
        "google-t5/t5-small": "df1b051c49625cf57a3d0d8d3863ed4d13564fe4",
        "google/umt5-small": "8c63c2b77efbf8e41206a2c8d994846cc9392360"
      }
    },
    "Whisper": {
      "integration": {
        "repo": "hf-internal-testing/Whisper-integration",
        "revision": "08ed0211558e7a10eafaea84132c2ce3c41dc91c",
        "files_sha256": "8289a6e94aab1eef57fc4993e9948c81813a4a85c506826c529be8d7ecafe4c6"
      },
      "fixtures": {
        "hf-internal-testing/mic-whisper-tiny-slim": {
          "revision": "7acfb01aa91f05eb0a1507e00878c3e42901e2cc",
          "files_sha256": "71e6e2a43065192dd2d535faaf16d2ed5bd2a6d6d7b8e66ef8388a159511ec9f"
        }
      },
      "checkpoints": {
        "openai/whisper-tiny": "169d4a4341b33bc18d8881c4b69c2e104e1cc0af"
      }
    },
    "Wav2Vec2": {
      "integration": {
        "repo": "hf-internal-testing/Wav2Vec2-integration",
        "revision": "e401e7bb27269f5948a4c1b4cf88bb456c3b1b59",
        "files_sha256": "e997a70b6fe818611c4040e167c1eda350e066ac9ecec4b229a777dbfd4bf192"
      },
      "fixtures": {
        "hf-internal-testing/mic-wav2vec2-base-960h-slim": {
          "revision": "69a1a6127c38056c7e7e2053e1d208b6380b152b",
          "files_sha256": "5522f324c0e8bd3e70aa54a57318e4d5016c46df7709120dfb632423f4221c2f"
        }
      },
      "checkpoints": {
        "facebook/wav2vec2-base-960h": "22aad52d435eb6dbaf354bdad9b0da84ce7d6156"
      }
    }
  },
  "environment": {
    "python": "3.10",
    "torch": "2.11.0",
    "torchvision": "0.26.0",
    "torchaudio": "2.11.0",
    "tokenizers": "0.23.1",
    "numpy": "1.26.4",
    "pillow": "12.2.0",
    "accelerate": "1.13.0",
    "safetensors": "0.8.0",
    "huggingface-hub": "1.32.0",
    "sentencepiece": "0.2.1",
    "protobuf": "6.33.6",
    "librosa": "0.11.0",
    "soundfile": "0.13.1",
    "scipy": "1.15.3"
  },
  "known_failures": {
    "Whisper/mic-whisper-tiny-slim": {
      "issue": "https://github.com/huggingface/transformers/issues/49456: generate() raises on suppress_tokens from config.json since #48282",
      "match": "You have modified the pretrained model configuration"
    },
    "Wav2Vec2/mic-wav2vec2-base-960h-slim": {
      "issue": "https://github.com/huggingface/transformers/issues/49385: masked_spec_embed uninitialized, so the SpecAugment loss and gradients are undefined (fix #49386)",
      "skip_outputs": [
        "training.gradients",
        "training.loss"
      ]
    }
  }
}
